[
{"id":"loot_drama_01","title":"Loot Council Meltdown","body":"Two DPS claim BiS daggers from last night’s raid.","tags":["player_drama","raid_loot"],"weights":{"base":5,"rep_low":1},"left":{"label":"Follow logs; award to top parse","effects":{"reputation":-1,"readiness":1},"hooks":[{"when":"trait:theorycrafter","effect":{"readiness":1}}]},"right":{"label":"Split tokens; defer BiS","effects":{"funds":-1,"reputation":1},"hooks":[{"when":"trait:drama_queen","effect":{"morale_all":-1}}]}}
,{"id":"afk_tank_01","title":"AFK Tank Again","body":"Main tank missed pull timer for the third time.","tags":["player_drama","raid_logistics"],"weights":{"base":5},"left":{"label":"Bench 1 week","effects":{"readiness":-1,"reputation":1}},"right":{"label":"Final warning","effects":{"reputation":-1},"hooks":[{"when":"trait:afk_farmer","effect":{"readiness":1}}]}}
,{"id":"patch_nerf_01","title":"Patch Nerf Hits","body":"Your top build got nerfed by 8%.","tags":["meta_shifts"],"weights":{"base":5},"left":{"label":"Swap comp now","effects":{"funds":-1,"readiness":1},"hooks":[{"when":"trait:meta_slave","effect":{"readiness":1}}]},"right":{"label":"Ride it out","effects":{"reputation":-1}}}
,{"id":"server_outage_01","title":"Server Outage","body":"Unexpected downtime ruins raid night.","tags":["dev_server"],"weights":{"base":4,"rep_low":1},"left":{"label":"Reschedule weekend","effects":{"funds":-1,"reputation":1}},"right":{"label":"Backup content","effects":{"readiness":-1,"funds":1}}}
,{"id":"parse_war_01","title":"Parse War","body":"Two DPS flame each other over meters.","tags":["player_drama"],"weights":{"base":5},"left":{"label":"Public call-out","effects":{"reputation":-1,"readiness":1}},"right":{"label":"Private mediation","effects":{"funds":-1,"morale_all":1}}}
,{"id":"boost_request_01","title":"Boost Request","body":"A whale offers gold for a carry.","tags":["meta_economy","community_pr"],"weights":{"base":3},"left":{"label":"Accept quietly","effects":{"funds":2,"reputation":-1}},"right":{"label":"Decline politely","effects":{"reputation":1}}}
,{"id":"exploit_found_01","title":"Cheese Strat Found","body":"An exploit trivializes a boss pre-hotfix.","tags":["meta_shifts"],"weights":{"base":4},"left":{"label":"Use before fix","effects":{"readiness":2,"reputation":-2}},"right":{"label":"Avoid cheese","effects":{"reputation":1}}}
,{"id":"recruit_trial_01","title":"Healer Trial","body":"Applicant has mixed logs but strong comms.","tags":["raid_logistics","community_pr"],"weights":{"base":4},"left":{"label":"Fast-track","effects":{"readiness":1,"funds":-1}},"right":{"label":"Require VODs","effects":{"reputation":1}}}
,{"id":"streamer_spotlight_01","title":"Streamer Spotlight","body":"Mid-tier streamer covers your guild.","tags":["community_pr"],"weights":{"base":3},"left":{"label":"Invite collab","effects":{"funds":-1,"reputation":2}},"right":{"label":"Ignore politely","effects":{}}}
,{"id":"bench_healer_01","title":"Healer Burnout","body":"Healer reports burnout after back-to-back prog.","tags":["raid_logistics"],"weights":{"base":5},"left":{"label":"Force rest","effects":{"readiness":-1,"morale_all":1}},"right":{"label":"Push through","effects":{"reputation":-1}}}
,{"id":"bench_dps_01","title":"Bench DPS","body":"Roster overflow; two melee for one slot.","tags":["raid_logistics"],"weights":{"base":4},"left":{"label":"Rotate weekly","effects":{"reputation":1}},"right":{"label":"Pick top parse","effects":{"readiness":1,"reputation":-1}}}
,{"id":"consumables_spike_01","title":"Flask Prices Spike","body":"Consumables cost doubles on raid days.","tags":["meta_economy"],"weights":{"base":4},"left":{"label":"Subsidize flasks","effects":{"funds":-2,"reputation":1}},"right":{"label":"BYO only","effects":{"reputation":-1}}}
,{"id":"guild_bank_short_01","title":"Guild Bank Short","body":"Bank low after repairs and subs.","tags":["meta_economy"],"weights":{"base":5},"left":{"label":"Cut perks","effects":{"reputation":-1,"funds":1}},"right":{"label":"Donation drive","effects":{"funds":1,"reputation":1}}}
,{"id":"alt_run_request_01","title":"Alt Run Request","body":"Members ask for weekly alt runs.","tags":["raid_logistics","community_pr"],"weights":{"base":4},"left":{"label":"Schedule alts","effects":{"funds":-1,"reputation":1}},"right":{"label":"Main focus only","effects":{"reputation":-1}}}
,{"id":"late_start_01","title":"Late Start","body":"Half the raid shows up 15 minutes late.","tags":["raid_logistics"],"weights":{"base":5},"left":{"label":"Strict start","effects":{"reputation":-1,"readiness":1}},"right":{"label":"Grace period","effects":{"reputation":1}}}
,{"id":"bench_rotation_01","title":"Bench Rotation","body":"Benched players feel excluded.","tags":["player_drama"],"weights":{"base":4},"left":{"label":"Transparent schedule","effects":{"reputation":1}},"right":{"label":"Coach top squad","effects":{"readiness":1,"reputation":-1}}}
,{"id":"healer_burnout_02","title":"Healer Threatens Quit","body":"Says they’ll quit if no backup.","tags":["player_drama","raid_logistics"],"weights":{"base":5},"left":{"label":"Recruit backup","effects":{"funds":-1,"readiness":1}},"right":{"label":"Counter-offer","effects":{"reputation":-1}}}
,{"id":"attendance_slump_01","title":"Attendance Slump","body":"Work/school season hurts attendance.","tags":["raid_logistics"],"weights":{"base":4},"left":{"label":"Shorter raids","effects":{"reputation":1}},"right":{"label":"Fewer nights","effects":{"readiness":-1,"funds":1}}}
,{"id":"voice_comms_drama_01","title":"Comms Blowup","body":"Heated argument in voice during wipes.","tags":["player_drama"],"weights":{"base":5},"left":{"label":"Mute offenders","effects":{"reputation":-1,"readiness":1}},"right":{"label":"Mediation circle","effects":{"funds":-1,"morale_all":1}}}
,{"id":"strat_disagreement_01","title":"Strat Disagreement","body":"Two approaches split the team.","tags":["raid_logistics","meta_shifts"],"weights":{"base":4},"left":{"label":"Try meta strat","effects":{"readiness":1},"hooks":[{"when":"trait:meta_slave","effect":{"readiness":1}}]},"right":{"label":"Homebrew strat","effects":{"reputation":1}}}
,{"id":"poach_attempt_01","title":"Poach Attempt","body":"Top guild whispers your healer.","tags":["community_pr"],"weights":{"base":3},"left":{"label":"Match perks","effects":{"funds":-1,"reputation":1}},"right":{"label":"Wish them well","effects":{"reputation":-1}}}
,{"id":"ninja_pull_01","title":"Ninja Pull","body":"Over-eager DPS pulls early.","tags":["player_drama"],"weights":{"base":5},"left":{"label":"Public reprimand","effects":{"reputation":-1}},"right":{"label":"Quiet feedback","effects":{"morale_all":1}}}
,{"id":"macro_spam_01","title":"Macro Spam","body":"Annoying macros flood raid chat.","tags":["player_drama"],"weights":{"base":3},"left":{"label":"Ban macros","effects":{"reputation":1}},"right":{"label":"Allow memes","effects":{"reputation":-1}}}
,{"id":"meme_channel_01","title":"Meme Channel","body":"Should memes be separated from raid chat?","tags":["community_pr"],"weights":{"base":3},"left":{"label":"Create #memes","effects":{"reputation":1}},"right":{"label":"Keep one chat","effects":{"reputation":-1}}}
,{"id":"parse_chase_01","title":"Parse Chase","body":"Players chasing oranges ignore mechanics.","tags":["player_drama","raid_logistics"],"weights":{"base":4},"left":{"label":"Mechanics first","effects":{"reputation":1}},"right":{"label":"Let them fly","effects":{"readiness":1,"reputation":-1}}}
,{"id":"chat_report_01","title":"Report Filed","body":"External player reports toxic whisper.","tags":["community_pr"],"weights":{"base":3},"left":{"label":"Zero tolerance","effects":{"reputation":1}},"right":{"label":"Warn only","effects":{"reputation":-1}}}
,{"id":"new_raid_tease_01","title":"New Raid Tease","body":"Trailer drops; hype builds.","tags":["meta_shifts","community_pr"],"weights":{"base":2},"left":{"label":"Hype video","effects":{"funds":-1,"reputation":1}},"right":{"label":"Stay quiet","effects":{}}}
,{"id":"ptr_findings_01","title":"PTR Findings","body":"PTR shows add-heavy fights.","tags":["meta_shifts"],"weights":{"base":3},"left":{"label":"Recruit AoE DPS","effects":{"funds":-1,"readiness":1}},"right":{"label":"Trust current comp","effects":{}}}
,{"id":"live_bug_01","title":"Live Bug","body":"Boss bug resets progress.","tags":["dev_server"],"weights":{"base":3},"left":{"label":"File ticket","effects":{"reputation":1}},"right":{"label":"Push anyway","effects":{"readiness":-1}}}
,{"id":"raid_check_01","title":"Raid Night Check","body":"How did raid go?","tags":["raid_night_check","raid_logistics"],"weights":{"base":5},"left":{"label":"Strict execution","effects":{"reputation":1,"readiness":1},"hooks":[{"when":"trait:guild_leader","effect":{"reputation":1}}]},"right":{"label":"Chill vibes","effects":{"morale_all":1,"reputation":-1}}}
,{"id":"raid_check_02","title":"Raid Night Check","body":"Roster stability this week?","tags":["raid_night_check","raid_logistics"],"weights":{"base":5},"left":{"label":"Optimize assignments","effects":{"readiness":1},"hooks":[{"when":"trait:theorycrafter","effect":{"readiness":1}}]},"right":{"label":"Keep it casual","effects":{"reputation":1}}}
,{"id":"raid_check_03","title":"Raid Night Check","body":"Loot drama handled?","tags":["raid_night_check","player_drama"],"weights":{"base":5},"left":{"label":"Post logs publicly","effects":{"reputation":-1,"readiness":1}},"right":{"label":"Private awards","effects":{"reputation":1}}}
,{"id":"raid_check_04","title":"Raid Night Check","body":"Meta swaps applied?","tags":["raid_night_check","meta_shifts"],"weights":{"base":5},"left":{"label":"Swap to meta","effects":{"readiness":1},"hooks":[{"when":"trait:meta_slave","effect":{"readiness":1}}]},"right":{"label":"Stay off-meta","effects":{"reputation":1}}}
]

